<?xml version="1.0" encoding="UTF-8"?>
<dataroot xmlns:od="urn:schemas-microsoft-com:officedata" xmlns:xsi="http://www.w3.org/2001/XMLSchema-instance"  xsi:noNamespaceSchemaLocation="Stock.xsd" generated="2019-12-17T10:28:20">
<Stock>
<ItemCode>1002</ItemCode>
<ItemName>Sardine</ItemName>
<UnitPrice>10</UnitPrice>
<QuantityRecorded>200</QuantityRecorded>
<RegistryDate>2019-12-13T00:00:00</RegistryDate>
<ID>1</ID>
<AvailableQuantity>0</AvailableQuantity>
</Stock>
<Stock>
<ItemCode>5544</ItemCode>
<ItemName>LAYER MASH</ItemName>
<UnitPrice>170</UnitPrice>
<QuantityRecorded>2000</QuantityRecorded>
<RegistryDate>2019-12-13T00:00:00</RegistryDate>
<ID>2</ID>
<AvailableQuantity>0</AvailableQuantity>
</Stock>
<Stock>
<ItemCode>001</ItemCode>
<ItemName>SOYA</ItemName>
<UnitPrice>200</UnitPrice>
<QuantityRecorded>300</QuantityRecorded>
<RegistryDate>2019-12-12T00:00:00</RegistryDate>
<ID>6</ID>
<AvailableQuantity>0</AvailableQuantity>
</Stock>
<Stock>
<ItemCode>002</ItemCode>
<ItemName>WHEAT BROWN</ItemName>
<UnitPrice>17</UnitPrice>
<QuantityRecorded>300</QuantityRecorded>
<RegistryDate>2019-12-14T00:00:00</RegistryDate>
<ID>7</ID>
<AvailableQuantity>280</AvailableQuantity>
</Stock>
<Stock>
<ItemCode>2241</ItemCode>
<ItemName>Alibaba</ItemName>
<UnitPrice>17</UnitPrice>
<QuantityRecorded>2000</QuantityRecorded>
<RegistryDate>2019-12-16T00:00:00</RegistryDate>
<ID>10</ID>
<AvailableQuantity>2000</AvailableQuantity>
</Stock>
<Stock>
<ItemCode>9988</ItemCode>
<ItemName>Corn</ItemName>
<UnitPrice>90</UnitPrice>
<QuantityRecorded>10</QuantityRecorded>
<RegistryDate>2019-12-16T00:00:00</RegistryDate>
<ID>12</ID>
<AvailableQuantity>10</AvailableQuantity>
</Stock>
<Stock>
<ItemCode>3344</ItemCode>
<ItemName>Eggs</ItemName>
<UnitPrice>9</UnitPrice>
<QuantityRecorded>2000</QuantityRecorded>
<RegistryDate>2019-12-16T00:00:00</RegistryDate>
<ID>13</ID>
<AvailableQuantity>2000</AvailableQuantity>
</Stock>
<Stock>
<ItemCode>909</ItemCode>
<ItemName>Fresh Fish</ItemName>
<UnitPrice>9</UnitPrice>
<QuantityRecorded>100</QuantityRecorded>
<RegistryDate>2019-12-17T00:00:00</RegistryDate>
<ID>14</ID>
<AvailableQuantity>0</AvailableQuantity>
</Stock>
</dataroot>
